### ISSUE TITLE
ADC in AWS reset connection

### ISSUE THREAD

**Issue by vintury** [aws-quickstart/quickstart-citrix-adc-vpx#5]
Hello.

Sometimes the ADC resets the input connection. Logs NSWL does not contains error connections.
Statistic: 3797 requests and 20 errors with reset code per service (about 12 hours).

For example errors from different web applications:
`WARN[1536200] Service service.example.com Failing: HTTP Error Get "https://service.example.com/method": read tcp 10.233.81.125:43144->10.0.32.37:443: read: connection reset by peer | Lookup in: 1711 μs  type=service`
For java applications:
`[5050] I/O error on POST request for "https://service.example.com": Connection reset; nested exception is javax.net.ssl.SSLException: Connection reset`

TCPDUMMP on ADC:
With error:
```
IP 10.0.2.62.58236 > 10.0.32.37.443: Flags [S], seq 168513912, win 29200, options [mss 1460,sackOK,TS val 966519278 ecr 0,nop,wscale 7], length 0
IP 10.0.32.37.443 > 10.0.2.62.58236: Flags [S.], seq 3705555186, ack 168513913, win 8190, options [mss 1460,nop,wscale 8,nop,nop,sackOK], length 0
IP 10.0.2.62.58236 > 10.0.32.37.443: Flags [.], ack 1, win 229, length 0
IP 10.0.2.62.58236 > 10.0.32.37.443: Flags [P.], seq 1:281, ack 1, win 229, length 280
IP 10.0.32.37.443 > 10.0.2.62.58236: Flags [P.], seq 1:94, ack 281, win 510, length 93
IP 10.0.32.37.443 > 10.0.2.62.58236: Flags [P.], seq 94:100, ack 281, win 510, length 6
IP 10.0.2.62.58236 > 10.0.32.37.443: Flags [.], ack 94, win 229, length 0
IP 10.0.2.62.58236 > 10.0.32.37.443: Flags [.], ack 100, win 229, length 0
IP 10.0.2.62.58236 > 10.0.32.37.443: Flags [P.], seq 281:287, ack 100, win 229, length 6
IP 10.0.2.62.58236 > 10.0.32.37.443: Flags [P.], seq 287:600, ack 100, win 229, length 313
IP 10.0.32.37.443 > 10.0.2.62.58236: Flags [.], ack 287, win 510, length 0
IP 10.0.32.37.443 > 10.0.2.62.58236: Flags [.], ack 600, win 509, length 0
IP 10.0.32.37.443 > 10.0.2.62.58236: Flags [P.], seq 100:260, ack 600, win 509, length 160
IP 10.0.32.37.443 > 10.0.2.62.58236: Flags [P.], seq 260:1720, ack 600, win 509, length 1460
IP 10.0.32.37.443 > 10.0.2.62.58236: Flags [P.], seq 1720:3119, ack 600, win 509, length 1399
IP 10.0.32.37.443 > 10.0.2.62.58236: Flags [P.], seq 3119:3713, ack 600, win 509, length 594
IP 10.0.2.62.58236 > 10.0.32.37.443: Flags [.], ack 1720, win 260, length 0
IP 10.0.2.62.58236 > 10.0.32.37.443: Flags [.], ack 3713, win 305, length 0
IP 10.0.2.62.58236 > 10.0.32.37.443: Flags [P.], seq 600:674, ack 3713, win 305, length 74
IP 10.0.32.37.443 > 10.0.2.62.58236: Flags [.], ack 674, win 509, length 0
IP 10.0.2.62.58236 > 10.0.32.37.443: Flags [P.], seq 674:869, ack 3713, win 305, length 195
IP 10.0.32.37.443 > 10.0.2.62.58236: Flags [.], ack 869, win 509, length 0
IP 10.0.32.37.443 > 10.0.2.62.58236: Flags [P.], seq 3713:4063, ack 869, win 510, length 350
IP 10.0.32.37.443 > 10.0.2.62.58236: Flags [FP.], seq 4063:4087, ack 869, win 510, length 24
IP 10.0.2.62.58236 > 10.0.32.37.443: Flags [.], ack 4088, win 328, length 0
IP 10.0.2.62.58236 > 10.0.32.37.443: Flags [P.], seq 869:893, ack 4088, win 328, length 24
IP 10.0.2.62.58236 > 10.0.32.37.443: Flags [F.], seq 893, ack 4088, win 328, length 0
IP 10.0.32.37.443 > 10.0.2.62.58236: Flags [.], ack 893, win 512, length 0
IP 10.0.32.37.443 > 10.0.2.62.58236: Flags [.], ack 894, win 512, length 0
```

Without Error:
```
IP 10.0.2.62.58342 > 10.0.32.37.443: Flags [S], seq 4281348909, win 29200, options [mss 1460,sackOK,TS val 966524278 ecr 0,nop,wscale 7], length 0
IP 10.0.32.37.443 > 10.0.2.62.58342: Flags [S.], seq 2634868525, ack 4281348910, win 8190, options [mss 1460,nop,wscale 8,nop,nop,sackOK], length 0
IP 10.0.2.62.58342 > 10.0.32.37.443: Flags [.], ack 1, win 229, length 0
IP 10.0.2.62.58342 > 10.0.32.37.443: Flags [P.], seq 1:281, ack 1, win 229, length 280
IP 10.0.32.37.443 > 10.0.2.62.58342: Flags [P.], seq 1:94, ack 281, win 510, length 93
IP 10.0.32.37.443 > 10.0.2.62.58342: Flags [P.], seq 94:100, ack 281, win 510, length 6
IP 10.0.2.62.58342 > 10.0.32.37.443: Flags [.], ack 94, win 229, length 0
IP 10.0.2.62.58342 > 10.0.32.37.443: Flags [.], ack 100, win 229, length 0
IP 10.0.2.62.58342 > 10.0.32.37.443: Flags [P.], seq 281:287, ack 100, win 229, length 6
IP 10.0.32.37.443 > 10.0.2.62.58342: Flags [.], ack 287, win 510, length 0
IP 10.0.2.62.58342 > 10.0.32.37.443: Flags [P.], seq 287:600, ack 100, win 229, length 313
IP 10.0.32.37.443 > 10.0.2.62.58342: Flags [.], ack 600, win 509, length 0
IP 10.0.32.37.443 > 10.0.2.62.58342: Flags [P.], seq 100:260, ack 600, win 509, length 160
IP 10.0.32.37.443 > 10.0.2.62.58342: Flags [P.], seq 260:1720, ack 600, win 509, length 1460
IP 10.0.32.37.443 > 10.0.2.62.58342: Flags [P.], seq 1720:3119, ack 600, win 509, length 1399
IP 10.0.32.37.443 > 10.0.2.62.58342: Flags [P.], seq 3119:3713, ack 600, win 509, length 594
IP 10.0.2.62.58342 > 10.0.32.37.443: Flags [.], ack 1720, win 260, length 0
IP 10.0.2.62.58342 > 10.0.32.37.443: Flags [.], ack 3713, win 305, length 0
IP 10.0.2.62.58342 > 10.0.32.37.443: Flags [P.], seq 600:674, ack 3713, win 305, length 74
IP 10.0.2.62.58342 > 10.0.32.37.443: Flags [P.], seq 674:869, ack 3713, win 305, length 195
IP 10.0.32.37.443 > 10.0.2.62.58342: Flags [.], ack 674, win 509, length 0
IP 10.0.32.37.443 > 10.0.2.62.58342: Flags [.], ack 869, win 509, length 0
IP 10.0.32.37.443 > 10.0.2.62.58342: Flags [P.], seq 3713:4063, ack 869, win 510, length 350
IP 10.0.32.37.443 > 10.0.2.62.58342: Flags [FP.], seq 4063:4087, ack 869, win 510, length 24
IP 10.0.2.62.58342 > 10.0.32.37.443: Flags [.], ack 4088, win 328, length 0
IP 10.0.2.62.58342 > 10.0.32.37.443: Flags [P.], seq 869:893, ack 4088, win 328, length 24
IP 10.0.32.37.443 > 10.0.2.62.58342: Flags [.], ack 893, win 512, length 0
IP 10.0.2.62.58342 > 10.0.32.37.443: Flags [F.], seq 893, ack 4088, win 328, length 0
IP 10.0.32.37.443 > 10.0.2.62.58342: Flags [.], ack 894, win 512, length 0
```

Instance settings:
```
Region: Frankfurt (eu-central-1c)
Citrix ADC VPX Advanced - 200 Mbps Hourly
ami id: ami-0e99927f9a779ec3f
ec2 type: c5.2xlarge
Source/Destination Check: Disabled
```

Service config:
```
> sh run | grep example
add serviceGroup tf-example_s_sg SSL -maxClient 0 -maxReq 0 -cip DISABLED -usip NO -useproxyport YES -cltTimeout 40 -svrTimeout 360 -CKA NO -TCPB NO -CMP NO
add serviceGroup tf-example_a_sg HTTP -maxClient 0 -maxReq 0 -cip DISABLED -usip NO -useproxyport YES -cltTimeout 40 -svrTimeout 360 -CKA NO -TCPB NO -CMP NO
add lb vserver tf-example_s_lb HTTP 0.0.0.0 0 -persistenceType NONE -cltTimeout 180
add lb vserver tf-example_a_lb HTTP 0.0.0.0 0 -persistenceType NONE -cltTimeout 180 -backupVServer tf-example_s_lb
add gslb vserver tf-service.example.com-gslbvs HTTP -backupLBMethod ROUNDROBIN -tolerance 0
set gslb vserver tf-service.example.com-gslbvs -backupLBMethod ROUNDROBIN -tolerance 0
add cs policy tf-example_0_cspol -rule "HTTP.REQ.HOSTNAME.SERVER.EQ(\"service.example.com\")"
add rewrite action tf-example_rwaction replace_all "HTTP.RES.BODY(200000)" "\"https://api.example.com\"" -search "regex(re~https\\:\\/\\/service\\.example\\.com~)"
add rewrite policy tf-example_rwpolicy TRUE tf-example_rwaction
add responder action tf-example_rsaction redirect "\"https://\" + http.req.hostname.HTTP_URL_SAFE + http.REQ.URL.PATH_AND_QUERY.HTTP_URL_SAFE"
add responder policy tf-example_rspolicy TRUE tf-example_rsaction
bind lb vserver tf-example_s_lb tf-example_s_sg
bind lb vserver tf-example_a_lb tf-example_a_sg
bind cs vserver tf-10.0.32.37_80_HTTP -policyName tf-example_rspolicy -priority 200 -gotoPriorityExpression END -type REQUEST
bind cs vserver tf-10.0.32.37_443_HTTPS -policyName tf-example_rwpolicy -priority 100 -gotoPriorityExpression END -type RESPONSE
bind cs vserver tf-10.0.32.37_443_HTTPS -policyName tf-example_0_cspol -targetLBVserver tf-example_a_lb -priority 100
bind gslb vserver tf-service.example.com-gslbvs -serviceName tf_10.0.32.37_dns_svc -weight 100
bind gslb vserver tf-service.example.com-gslbvs -domainName service.example.com -TTL 60
add lb monitor tf-example_a_mon HTTP -respCode 200 -httpRequest "GET /method" -interval 15 -resptimeout 10 -destPort 3004
bind serviceGroup tf-example_s_sg 13.13.13.13 443
bind serviceGroup tf-example_a_sg 10.102.0.1 3004
bind serviceGroup tf-example_a_sg -monitorName tf-example_a_mon
set ssl serviceGroup tf-example_s_sg -sslProfile ns_default_ssl_profile_backend
```

ADC statistics:
```
> sh ns version
	NetScaler NS13.0: Build 58.30.nc, Date: May 31 2020, 23:50:08   (64-bit)

> stat http
HTTP Statistics - Summary
                                          Rate (/s)                Total 
Total requests                                    70              2487463
Total responses                                   68              2467473
Request bytes received                        140227           6420686800
Response bytes received                        83014           4225720940

> stat interface
Interface Summary
ID             IntfState    IntfAlias Rx Bytes Tx Bytes  Rx Pkts  Tx Pkts 
1/1                   UP                14740M   19063M 35342911 38895143
LO/1                  UP               867134k    1049M  4637516  8969635

> stat instance
Cluster Instance Summary
Cluster size                                       1
Cluster status                              DISABLED
Configuration coordinator                    0.0.0.0
Total steered packets                              0

Backplane Statistics
                                        Rate (Mbps)        Total (Mbits) 
Traffic received                                   0                    0
Traffic transmitted                                0                    0

> stat cpu
CPU statistics
ID         Usage 
1              14
```
